{
  "schemaVersion": "1",
  "owner": "Justagwas",
  "repo": "github-downloads-action",
  "visibility": "public",
  "generatedAt": "2026-10-29T09:41:40.385Z",
  "stats": {
    "total": 0,
    "day": 0,
    "week": 0,
    "month": 0
  },
  "partial": {
    "day": false,
    "week": false,
    "month": false
  },
  "snapshots": {
    "windowDays": 45,
    "count": 45,
    "firstDate": "2026-09-15",
    "lastDate": "2026-10-29",
    "series": {
      "2026-09-15": 0,
      "2026-09-16": 0,
      "2026-09-17": 0,
      "2026-09-18": 0,
      "2026-09-19": 0,
      "2026-09-20": 0,
      "2026-09-21": 0,
      "2026-09-22": 0,
      "2026-09-23": 0,
      "2026-09-24": 0,
      "2026-09-25": 0,
      "2026-09-26": 0,
      "2026-09-27": 0,
      "2026-09-28": 0,
      "2026-09-29": 0,
      "2026-09-30": 0,
      "2026-10-01": 0,
      "2026-10-02": 0,
      "2026-10-03": 0,
      "2026-10-04": 0,
      "2026-10-05": 0,
      "2026-10-06": 0,
      "2026-10-07": 0,
      "2026-10-08": 0,
      "2026-10-09": 0,
      "2026-10-10": 0,
      "2026-10-11": 0,
      "2026-10-12": 0,
      "2026-10-13": 0,
      "2026-10-14": 0,
      "2026-10-15": 0,
      "2026-10-16": 0,
      "2026-10-17": 0,
      "2026-10-18": 0,
      "2026-10-19": 0,
      "2026-10-20": 0,
      "2026-10-21": 0,
      "2026-10-22": 0,
      "2026-10-23": 0,
      "2026-10-24": 0,
      "2026-10-25": 0,
      "2026-10-26": 0,
      "2026-10-27": 0,
      "2026-10-28": 0,
      "2026-10-29": 0
    }
  },
  "profile": {
    "defaultMode": "daily",
    "hourlyEnabled": false
  }
}
